{
  "$schema": "https://raw.githubusercontent.com/sergeychernov/article-writing-kit/main/skills/article-habr/assets/schemas/habr-hubs.schema.json",
  "source": "habr.com thematic hubs list (chips suggest panel)",
  "fetchedAt": "2026-07-08",
  "limits": {
    "maxHubs": 5,
    "maxTags": 10
  },
  "note": "Asterisk (*) in the source marks multiauthor thematic hubs — the only hubs a regular author can publish to. Stored as multiauthor:true. Hubs without * are corporate/single-author and cannot be freely selected.",
  "hubCount": 431,
  "hubs": [
    {
      "alias": "$mol",
      "title": "$mol",
      "multiauthor": true
    },
    {
      "alias": "*nix",
      "title": "*nix",
      "multiauthor": true
    },
    {
      "alias": ".net",
      "title": ".NET",
      "multiauthor": true
    },
    {
      "alias": "1с",
      "title": "1С",
      "multiauthor": true
    },
    {
      "alias": "1с-битрикс",
      "title": "1С-Битрикс",
      "multiauthor": true
    },
    {
      "alias": "3d-графика",
      "title": "3D-графика",
      "multiauthor": true
    },
    {
      "alias": "3d-принтеры",
      "title": "3D-принтеры",
      "multiauthor": false
    },
    {
      "alias": "accessibility",
      "title": "Accessibility",
      "multiauthor": true
    },
    {
      "alias": "action-script",
      "title": "Action Script",
      "multiauthor": true
    },
    {
      "alias": "adobe-flash",
      "title": "Adobe Flash",
      "multiauthor": false
    },
    {
      "alias": "agile",
      "title": "Agile",
      "multiauthor": true
    },
    {
      "alias": "ajax",
      "title": "Ajax",
      "multiauthor": true
    },
    {
      "alias": "amazon-web-services",
      "title": "Amazon Web Services",
      "multiauthor": true
    },
    {
      "alias": "android",
      "title": "Android",
      "multiauthor": true
    },
    {
      "alias": "angular",
      "title": "Angular",
      "multiauthor": true
    },
    {
      "alias": "apache",
      "title": "Apache",
      "multiauthor": true
    },
    {
      "alias": "apache-flex",
      "title": "Apache Flex",
      "multiauthor": true
    },
    {
      "alias": "ar-и-vr",
      "title": "AR и VR",
      "multiauthor": false
    },
    {
      "alias": "arduino",
      "title": "Arduino",
      "multiauthor": true
    },
    {
      "alias": "asp",
      "title": "ASP",
      "multiauthor": true
    },
    {
      "alias": "assembler",
      "title": "Assembler",
      "multiauthor": true
    },
    {
      "alias": "asterisk",
      "title": "Asterisk",
      "multiauthor": true
    },
    {
      "alias": "atlassian",
      "title": "Atlassian",
      "multiauthor": true
    },
    {
      "alias": "bada",
      "title": "Bada",
      "multiauthor": true
    },
    {
      "alias": "big-data",
      "title": "Big Data",
      "multiauthor": true
    },
    {
      "alias": "brainfuck",
      "title": "Brainfuck",
      "multiauthor": true
    },
    {
      "alias": "bug-hunters",
      "title": "Bug hunters",
      "multiauthor": true
    },
    {
      "alias": "c",
      "title": "C",
      "multiauthor": true
    },
    {
      "alias": "c#",
      "title": "C#",
      "multiauthor": true
    },
    {
      "alias": "c++",
      "title": "C++",
      "multiauthor": true
    },
    {
      "alias": "cad-cam",
      "title": "CAD/CAM",
      "multiauthor": true
    },
    {
      "alias": "cakephp",
      "title": "CakePHP",
      "multiauthor": true
    },
    {
      "alias": "canvas",
      "title": "Canvas",
      "multiauthor": true
    },
    {
      "alias": "cgi-графика",
      "title": "CGI (графика)",
      "multiauthor": true
    },
    {
      "alias": "cisco",
      "title": "Cisco",
      "multiauthor": true
    },
    {
      "alias": "clojure",
      "title": "Clojure",
      "multiauthor": true
    },
    {
      "alias": "cms",
      "title": "CMS",
      "multiauthor": true
    },
    {
      "alias": "cobol",
      "title": "Cobol",
      "multiauthor": true
    },
    {
      "alias": "cocoa",
      "title": "Cocoa",
      "multiauthor": true
    },
    {
      "alias": "codeigniter",
      "title": "CodeIgniter",
      "multiauthor": true
    },
    {
      "alias": "coffeescript",
      "title": "CoffeeScript",
      "multiauthor": true
    },
    {
      "alias": "creative-commons",
      "title": "Creative Commons",
      "multiauthor": true
    },
    {
      "alias": "crm-системы",
      "title": "CRM-системы",
      "multiauthor": true
    },
    {
      "alias": "css",
      "title": "CSS",
      "multiauthor": true
    },
    {
      "alias": "ctf",
      "title": "CTF",
      "multiauthor": true
    },
    {
      "alias": "cubrid",
      "title": "Cubrid",
      "multiauthor": true
    },
    {
      "alias": "d",
      "title": "D",
      "multiauthor": true
    },
    {
      "alias": "dart",
      "title": "Dart",
      "multiauthor": true
    },
    {
      "alias": "data-engineering",
      "title": "Data Engineering",
      "multiauthor": true
    },
    {
      "alias": "data-mining",
      "title": "Data Mining",
      "multiauthor": true
    },
    {
      "alias": "delphi",
      "title": "Delphi",
      "multiauthor": true
    },
    {
      "alias": "derby.js",
      "title": "Derby.js",
      "multiauthor": true
    },
    {
      "alias": "developer-relations",
      "title": "Developer Relations",
      "multiauthor": true
    },
    {
      "alias": "diy-или-сделай-сам",
      "title": "DIY или Сделай сам",
      "multiauthor": false
    },
    {
      "alias": "django",
      "title": "Django",
      "multiauthor": true
    },
    {
      "alias": "dns",
      "title": "DNS",
      "multiauthor": true
    },
    {
      "alias": "doctrine-orm",
      "title": "Doctrine ORM",
      "multiauthor": true
    },
    {
      "alias": "drupal",
      "title": "Drupal",
      "multiauthor": true
    },
    {
      "alias": "eclipse",
      "title": "Eclipse",
      "multiauthor": true
    },
    {
      "alias": "ecm-сэд",
      "title": "ECM/СЭД",
      "multiauthor": true
    },
    {
      "alias": "elixir-phoenix",
      "title": "Elixir/Phoenix",
      "multiauthor": true
    },
    {
      "alias": "elm",
      "title": "Elm",
      "multiauthor": true
    },
    {
      "alias": "emacs",
      "title": "Emacs",
      "multiauthor": true
    },
    {
      "alias": "email-маркетинг",
      "title": "Email-маркетинг",
      "multiauthor": true
    },
    {
      "alias": "ember.js",
      "title": "Ember.js",
      "multiauthor": true
    },
    {
      "alias": "erlang-otp",
      "title": "Erlang/OTP",
      "multiauthor": true
    },
    {
      "alias": "erp-системы",
      "title": "ERP-системы",
      "multiauthor": true
    },
    {
      "alias": "f#",
      "title": "F#",
      "multiauthor": true
    },
    {
      "alias": "facebook-api",
      "title": "Facebook API",
      "multiauthor": true
    },
    {
      "alias": "fidonet",
      "title": "Fidonet",
      "multiauthor": true
    },
    {
      "alias": "firebird-interbase",
      "title": "Firebird/Interbase",
      "multiauthor": true
    },
    {
      "alias": "firefox",
      "title": "Firefox",
      "multiauthor": false
    },
    {
      "alias": "flask",
      "title": "Flask",
      "multiauthor": true
    },
    {
      "alias": "flutter",
      "title": "Flutter",
      "multiauthor": true
    },
    {
      "alias": "forth",
      "title": "Forth",
      "multiauthor": true
    },
    {
      "alias": "fortran",
      "title": "Fortran",
      "multiauthor": true
    },
    {
      "alias": "fpga",
      "title": "FPGA",
      "multiauthor": true
    },
    {
      "alias": "github",
      "title": "GitHub",
      "multiauthor": true
    },
    {
      "alias": "go",
      "title": "Go",
      "multiauthor": true
    },
    {
      "alias": "godot",
      "title": "Godot",
      "multiauthor": true
    },
    {
      "alias": "google-api",
      "title": "Google API",
      "multiauthor": true
    },
    {
      "alias": "google-app-engine",
      "title": "Google App Engine",
      "multiauthor": true
    },
    {
      "alias": "google-chrome",
      "title": "Google Chrome",
      "multiauthor": false
    },
    {
      "alias": "google-cloud-platform",
      "title": "Google Cloud Platform",
      "multiauthor": true
    },
    {
      "alias": "google-cloud-vision-api",
      "title": "Google Cloud Vision API",
      "multiauthor": true
    },
    {
      "alias": "google-web-toolkit",
      "title": "Google Web Toolkit",
      "multiauthor": true
    },
    {
      "alias": "google-таблицы",
      "title": "Google Таблицы",
      "multiauthor": false
    },
    {
      "alias": "gpgpu",
      "title": "GPGPU",
      "multiauthor": true
    },
    {
      "alias": "gradle",
      "title": "Gradle",
      "multiauthor": true
    },
    {
      "alias": "greasemonkey",
      "title": "GreaseMonkey",
      "multiauthor": true
    },
    {
      "alias": "groovy-grails",
      "title": "Groovy & Grails",
      "multiauthor": true
    },
    {
      "alias": "growth-hacking",
      "title": "Growth Hacking",
      "multiauthor": true
    },
    {
      "alias": "gtd",
      "title": "GTD",
      "multiauthor": true
    },
    {
      "alias": "gtk+",
      "title": "GTK+",
      "multiauthor": true
    },
    {
      "alias": "habr",
      "title": "Habr",
      "multiauthor": false
    },
    {
      "alias": "hadoop",
      "title": "Hadoop",
      "multiauthor": true
    },
    {
      "alias": "haskell",
      "title": "Haskell",
      "multiauthor": true
    },
    {
      "alias": "haxe",
      "title": "Haxe",
      "multiauthor": true
    },
    {
      "alias": "help-desk-software",
      "title": "Help Desk Software",
      "multiauthor": true
    },
    {
      "alias": "html",
      "title": "HTML",
      "multiauthor": true
    },
    {
      "alias": "htmx",
      "title": "htmx",